,,,,,,,
Waller County,473,Hempstead,1873,Austin County and Grimes County,"Edwin Waller (1800–1881), a signer of the Texas Declaration of Independence and the first mayor of Austin, Texas",51307,514 sq mi
"(1,331 km2)",State map highlighting Waller County,,,,,,
Ward County,475,Monahans,1887,Tom Green County,"Thomas William Ward, a commissioner for the General Land Office of Texas and mayor of Austin, Texas",11472,836 sq mi
"(2,165 km2)",State map highlighting Ward County,,,,,,
Washington County,477,Brenham,1836,One of the original 23 counties,"George Washington, the first president of the United States (1789–1797)",35043,609 sq mi
"(1,577 km2)",State map highlighting Washington County,,,,,,
Webb County,479,Laredo,1848,Nueces County,"James Webb, who served as secretary of the Treasury, secretary of State, and Attorney General of the Republic of Texas",274794,"3,357 sq mi"
"(8,695 km2)",State map highlighting Webb County,,,,,,
Wharton County,481,Wharton,1846,"Colorado County, Jackson County and Matagorda County","William Harris Wharton (1802–1839) and John Austin Wharton (1828–1865), brothers and officers in the Texas Revolution",41968,"1,090 sq mi"
"(2,823 km2)",State map highlighting Wharton County,,,,,,
Wheeler County,483,Wheeler,1876,Bexar County,"Royal Tyler Wheeler, the second Chief Justice of the Texas Supreme Court",5358,914 sq mi
"(2,367 km2)",State map highlighting Wheeler County,,,,,,
Wichita County,485,Wichita Falls,1858,Cooke County,The Wichita Native American tribe,132000,628 sq mi
"(1,627 km2)",State map highlighting Wichita County,,,,,,
Wilbarger County,487,Vernon,1858,Bexar County,"Josiah P. (1801–1845) and Mathias Wilbarger, brothers and early settlers; Josiah became a mythical figure for living 11 years after being scalped",12764,971 sq mi
"(2,515 km2)",State map highlighting Wilbarger County,,,,,,
Willacy County,489,Raymondville,1911,Cameron County and Hidalgo County,"John G. Willacy, Texas state senator who was the author of the bill that established the county",21584,597 sq mi
"(1,546 km2)",State map highlighting Willacy County,,,,,,
Williamson County,491,Georgetown,1848,Milam County,"Robert McAlpin Williamson, a leader and veteran of the Battle of San Jacinto",547545,"1,124 sq mi"
"(2,911 km2)",State map highlighting Williamson County,,,,,,
Wilson County,493,Floresville,1860,"Bexar County, Guadalupe County and Karnes County","James Charles Wilson, a Texas state senator (1851–1853)",49304,807 sq mi
"(2,090 km2)",State map highlighting Wilson County,,,,,,
Winkler County,495,Kermit,1887,Tom Green County,"Clinton Winkler, an appeals court judge, Texas state representative, and Confederate colonel",7574,841 sq mi
"(2,178 km2)",State map highlighting Winkler County,,,,,,
Wise County,497,Decatur,1856,Cooke County,"Henry Alexander Wise, the U.S. Congressman and future thirty-eighth governor of Virginia (1856–1860) who supported the annexation of Texas",66181,905 sq mi
"(2,344 km2)",State map highlighting Wise County,,,,,,
Wood County,499,Quitman,1850,Van Zandt County,"George Tyler Wood, the second governor of Texas (1847–1849)",44314,650 sq mi
"(1,683 km2)",State map highlighting Wood County,,,,,,
Yoakum County,501,Plains,1876,Bexar County,"Henderson King Yoakum (1810–1856), soldier, attorney, and Texas historian",8568,800 sq mi
"(2,072 km2)",State map highlighting Yoakum County,,,,,,
Young County,503,Graham,1856,Bosque County and Fannin County,"William Cocke Young, early Texas settler, attorney, sheriff, and United States Marshal",17979,922 sq mi
"(2,388 km2)",State map highlighting Young County,,,,,,
Zapata County,505,Zapata,1858,Starr County and Webb County,"José Antonio Zapata, a local rancher and colonel of the short-lived Republic of the Rio Grande",14322,997 sq mi
"(2,582 km2)",State map highlighting Zapata County,,,,,,
Zavala County,507,Crystal City,1846,Maverick County,"Lorenzo de Zavala (1788–1836), signer of the Texas Declaration of Independence and the first Vice-President of the Republic of Texas",11948,"1,299 sq mi"
"(3,364 km2)",State map highlighting Zavala County,,,,,,
